{
  "slug": "chuspa-weaving",
  "name": "Chuspa weaving",
  "aliases": [
    "Chuspa",
    "Chuspa bag",
    "Coca bag"
  ],
  "category": "Regional & Cultural Tradition",
  "subcategory": "Regional & Cultural Tradition",
  "establishment": "regional_tradition",
  "status": "draft",
  "confidence": 95,
  "origin": "Andean region",
  "geography": "Peru, Bolivia, Ecuador",
  "periodStart": "Pre-colonial",
  "periodEnd": "present",
  "startYear": null,
  "endYear": null,
  "era": "Indigenous tradition",
  "summary": "A small woven bag traditionally used for carrying coca leaves and personal items, featuring distinctive geometric patterns and symbolic designs.",
  "description": "Characterized by small size (typically 15-25 cm) with intricate geometric patterns in contrasting colors, often featuring checkerboard designs and symbolic motifs. These bags are traditionally woven using backstrap looms with techniques that vary by region, serving both practical and ceremonial functions in Andean communities.",
  "culturalContext": "Conquistador Francisco Fajardo arrived to this place in 1555 in his quest to control the Caracas region. Cocoa plantations were established in the Chuspa Valley during the Colonial time.\n\nDuring the 17th century plantation owners brought in African slaves in increasing numbers. The Chuspa region had about 200000 cocoa trees by the second half of the 19th century.\n\nOn 18 November 1813 a sea battle between the pro-independence and the Spanish forces took place between Puerto Francés and Chuspa. The pro-independence troops, led by Manuel Piar, ended up defeating the royalists.",
  "colors": [
    {
      "hex": "#000000",
      "name": "Black"
    },
    {
      "hex": "#ffffff",
      "name": "White"
    },
    {
      "hex": "#ff0000",
      "name": "Red"
    },
    {
      "hex": "#008000",
      "name": "Green"
    },
    {
      "hex": "#ffd700",
      "name": "Gold"
    }
  ],
  "visualDNA": {},
  "typography": {},
  "typePairing": {},
  "materials": [
    "Alpaca wool",
    "Sheep wool",
    "Cotton",
    "Natural dyes",
    "Backstrap loom"
  ],
  "textures": [
    "Woven",
    "Geometric",
    "Compact",
    "Symbolic"
  ],
  "lighting": {},
  "photography": {},
  "architecture": {},
  "fashion": {},
  "objects": [
    "Small carrying bags",
    "Coca leaf containers",
    "Personal pouches",
    "Ceremonial bags",
    "Necklaces",
    "Decorative items"
  ],
  "environment": {},
  "graphicDesign": {},
  "uiTranslation": {},
  "recipe": {},
  "emotionProfile": {},
  "dnaAxes": {},
  "keyExamples": [
    "Andean textile markets",
    "Museo de Arte Popular Americano (Lima)",
    "Community craft cooperatives"
  ],
  "sounds": [],
  "tags": [
    "andean",
    "textile",
    "small",
    "geometric",
    "practical",
    "symbolic"
  ],
  "images": [
    {
      "url": "https://upload.wikimedia.org/wikipedia/commons/8/89/Iglesiachuspa.jpg",
      "thumb": "https://upload.wikimedia.org/wikipedia/commons/8/89/Iglesiachuspa.jpg",
      "full": "https://upload.wikimedia.org/wikipedia/commons/8/89/Iglesiachuspa.jpg",
      "pageUrl": "https://commons.wikimedia.org/wiki/File:Iglesiachuspa.jpg",
      "caption": "Church of Chuspa, Vargas, Venezuela. Picture donated by Guillermo Mantovani.",
      "source": "Wikimedia Commons",
      "artist": "La Revolución Vive",
      "date": "2009",
      "license": "CC BY 3.0",
      "licenseUrl": "https://creativecommons.org/licenses/by/3.0",
      "width": "922",
      "height": "692",
      "check": {
        "ok": true,
        "status": 200,
        "checkedAt": "2026-09-19T12:55:09.876Z"
      }
    },
    {
      "url": "https://thumb.wikimedia.org/wikipedia/commons/thumb/4/41/Catching_The_Sunset.JPG/1280px-Catching_The_Sunset.JPG",
      "thumb": "https://thumb.wikimedia.org/wikipedia/commons/thumb/4/41/Catching_The_Sunset.JPG/500px-Catching_The_Sunset.JPG",
      "full": "https://upload.wikimedia.org/wikipedia/commons/4/41/Catching_The_Sunset.JPG",
      "pageUrl": "https://commons.wikimedia.org/wiki/File:Catching_The_Sunset.JPG",
      "caption": "Chuspa. Edo. Vargas.",
      "source": "Wikimedia Commons",
      "artist": "Jesus Rafael Rodriguez J-Rude",
      "date": "2011-06-25 16:08:24",
      "license": "CC BY-SA 3.0",
      "licenseUrl": "https://creativecommons.org/licenses/by-sa/3.0",
      "width": "1280",
      "height": "959",
      "check": {
        "ok": true,
        "status": 200,
        "checkedAt": "2026-09-19T12:55:09.876Z"
      }
    },
    {
      "url": "https://thumb.wikimedia.org/wikipedia/commons/thumb/b/bf/Chuspa%2C_Playas.JPG/1280px-Chuspa%2C_Playas.JPG",
      "thumb": "https://thumb.wikimedia.org/wikipedia/commons/thumb/b/bf/Chuspa%2C_Playas.JPG/500px-Chuspa%2C_Playas.JPG",
      "full": "https://upload.wikimedia.org/wikipedia/commons/b/bf/Chuspa%2C_Playas.JPG",
      "pageUrl": "https://commons.wikimedia.org/wiki/File:Chuspa,_Playas.JPG",
      "caption": "Chuspa, Playas",
      "source": "Wikimedia Commons",
      "artist": "Hugo Guerrero G",
      "date": "2014-04-16 11:13:27",
      "license": "CC BY-SA 3.0",
      "licenseUrl": "https://creativecommons.org/licenses/by-sa/3.0",
      "width": "1280",
      "height": "956",
      "check": {
        "ok": true,
        "status": 200,
        "checkedAt": "2026-09-19T12:55:09.876Z"
      }
    },
    {
      "url": "https://thumb.wikimedia.org/wikipedia/commons/thumb/1/1a/Chuspa.JPG/1280px-Chuspa.JPG",
      "thumb": "https://thumb.wikimedia.org/wikipedia/commons/thumb/1/1a/Chuspa.JPG/500px-Chuspa.JPG",
      "full": "https://upload.wikimedia.org/wikipedia/commons/1/1a/Chuspa.JPG",
      "pageUrl": "https://commons.wikimedia.org/wiki/File:Chuspa.JPG",
      "caption": "Posada Azul Chuspa",
      "source": "Wikimedia Commons",
      "artist": "Hugo Guerrero G",
      "date": "2014-04-17 09:12:54",
      "license": "CC BY-SA 3.0",
      "licenseUrl": "https://creativecommons.org/licenses/by-sa/3.0",
      "width": "1280",
      "height": "956",
      "check": {
        "ok": true,
        "status": 200,
        "checkedAt": "2026-09-19T12:55:09.876Z"
      }
    },
    {
      "url": "https://thumb.wikimedia.org/wikipedia/commons/thumb/d/d9/Playa_Mono_Manso_-_Chuspa_-_Venezuela.jpg/1280px-Playa_Mono_Manso_-_Chuspa_-_Venezuela.jpg",
      "thumb": "https://thumb.wikimedia.org/wikipedia/commons/thumb/d/d9/Playa_Mono_Manso_-_Chuspa_-_Venezuela.jpg/500px-Playa_Mono_Manso_-_Chuspa_-_Venezuela.jpg",
      "full": "https://upload.wikimedia.org/wikipedia/commons/d/d9/Playa_Mono_Manso_-_Chuspa_-_Venezuela.jpg",
      "pageUrl": "https://commons.wikimedia.org/wiki/File:Playa_Mono_Manso_-_Chuspa_-_Venezuela.jpg",
      "caption": "Mono Manso beach, in Venezuela .",
      "source": "Wikimedia Commons",
      "artist": "Paolo Costa Baldi",
      "date": "2011-08-13",
      "license": "CC BY-SA 3.0",
      "licenseUrl": "https://creativecommons.org/licenses/by-sa/3.0",
      "width": "1280",
      "height": "712",
      "check": {
        "ok": true,
        "status": 200,
        "checkedAt": "2026-09-19T12:55:09.876Z"
      }
    }
  ],
  "sources": [
    {
      "name": "Chuspa: The Coca Leaf Bag",
      "url": "https://www.andeantravelweb.com/peru/cusco/chuspa.php",
      "tier": "B",
      "check": {
        "ok": true,
        "status": 200,
        "checkedAt": "2026-09-19T12:55:09.876Z"
      }
    },
    {
      "name": "Andean Textiles: Chuspa",
      "url": "https://www.metmuseum.org/toah/hd/anbt/hd_anbt.htm",
      "tier": "A",
      "check": {
        "ok": true,
        "status": 0,
        "checkedAt": "2026-09-19T12:55:09.876Z"
      }
    },
    {
      "name": "Traditional Andean Textiles",
      "tier": "A"
    }
  ],
  "references": [
    {
      "type": "images",
      "title": "Wikimedia Commons — Chuspa",
      "url": "https://commons.wikimedia.org/wiki/Category:Chuspa",
      "note": "Freely licensed photographs and scans",
      "check": {
        "ok": true,
        "status": 200,
        "checkedAt": "2026-09-19T12:55:09.876Z"
      }
    },
    {
      "type": "archive",
      "title": "Wikidata — Q1090013",
      "url": "https://www.wikidata.org/wiki/Q1090013",
      "note": "Structured data: dates, places, people, identifiers",
      "check": {
        "ok": true,
        "status": 200,
        "checkedAt": "2026-09-19T12:55:09.876Z"
      }
    },
    {
      "type": "article",
      "title": "Wikipedia — Chuspa",
      "url": "https://en.wikipedia.org/wiki/Chuspa",
      "note": "Encyclopedia article",
      "check": {
        "ok": true,
        "status": 200,
        "checkedAt": "2026-09-19T12:55:09.876Z"
      }
    }
  ],
  "wikidata": "Q1090013",
  "wikipedia": "Chuspa",
  "popularity": 40,
  "isNiche": true,
  "dataQuality": "well_documented",
  "verifiedAt": null,
  "createdAt": "2026-09-13T05:23:06.960Z",
  "updatedAt": "2026-10-02T06:41:24.363Z"
}
