{
  "slug": "confucian-art",
  "name": "Confucian art",
  "aliases": [],
  "category": "Painting Technique & School",
  "subcategory": "Art inspired by Confucius and his teachings",
  "establishment": "historical",
  "status": "draft",
  "confidence": 60,
  "origin": "China",
  "geography": "China",
  "periodStart": "",
  "periodEnd": "",
  "startYear": null,
  "endYear": null,
  "era": "",
  "summary": "Confucian art is art inspired by the writings of Confucius, and Confucian teachings.",
  "description": "Confucian art is art inspired by the writings of Confucius, and Confucian teachings. Confucian art originated in China, then spread westwards on the Silk Road, southward down to southern China and then onto Southeast Asia, and eastwards through northern China on to Japan and Korea. While it still maintains a strong influence within Indonesia, Confucian influence on western art has been limited. While Confucian themes enjoyed representation in Chinese art centers, they are fewer in comparison to the number of artworks that are about or influenced by Daoism and Buddhism.",
  "culturalContext": "",
  "colors": [],
  "paletteSource": "derived",
  "visualDNA": {},
  "typography": {},
  "typePairing": {},
  "materials": [],
  "textures": [],
  "lighting": {},
  "photography": {},
  "architecture": {},
  "fashion": {},
  "objects": [],
  "environment": {},
  "graphicDesign": {},
  "uiTranslation": {},
  "recipe": {},
  "emotionProfile": {},
  "dnaAxes": {},
  "keyExamples": [],
  "sounds": [],
  "tags": [
    "art genre"
  ],
  "images": [],
  "sources": [
    {
      "name": "Wikipedia — Confucian art",
      "url": "https://en.wikipedia.org/wiki/Confucian_art",
      "tier": "B",
      "check": {
        "ok": true,
        "status": 200,
        "checkedAt": "2026-09-19T12:55:09.876Z"
      }
    },
    {
      "name": "Wikidata — Q3624110",
      "url": "https://www.wikidata.org/wiki/Q3624110",
      "tier": "B",
      "check": {
        "ok": true,
        "status": 200,
        "checkedAt": "2026-09-19T12:55:09.876Z"
      }
    }
  ],
  "references": [
    {
      "type": "archive",
      "title": "Wikidata — Q3624110",
      "url": "https://www.wikidata.org/wiki/Q3624110",
      "note": "Structured data: dates, places, people, identifiers",
      "check": {
        "ok": true,
        "status": 200,
        "checkedAt": "2026-10-02T08:05:56.477Z"
      }
    },
    {
      "type": "article",
      "title": "Wikipedia — Confucian art",
      "url": "https://en.wikipedia.org/wiki/Confucian_art",
      "note": "Encyclopedia article",
      "check": {
        "ok": true,
        "status": 200,
        "checkedAt": "2026-10-02T08:05:56.477Z"
      }
    }
  ],
  "wikidata": "Q3624110",
  "wikipedia": "Confucian art",
  "popularity": 35,
  "isNiche": false,
  "dataQuality": "moderately_documented",
  "verifiedAt": null,
  "createdAt": "2026-09-18T10:32:48.407Z",
  "updatedAt": "2026-10-02T08:05:56.477Z"
}
