{
  "slug": "colonial-architecture-of-southeast-asia",
  "name": "Colonial architecture of Southeast Asia",
  "aliases": [
    "the colonial architecture of Southeast Asia"
  ],
  "category": "Architectural Style",
  "subcategory": "",
  "establishment": "regional_tradition",
  "status": "draft",
  "confidence": 60,
  "origin": "Southeast Asia",
  "geography": "Southeast Asia",
  "periodStart": "19th century",
  "periodEnd": "",
  "startYear": 1800,
  "endYear": null,
  "era": "19th century",
  "summary": "During the 17th, 18th, and 19th century, European nations began to consolidate naval routes into South East Asia, whereby India was used as the main trade route for ships to stop and refuel or trade.",
  "description": "During the 17th, 18th, and 19th century, European nations began to consolidate naval routes into South East Asia, whereby India was used as the main trade route for ships to stop and refuel or trade. Over this time, mostly during the 19th century, various Western Colonies began to gain influence various countries and construct colonial architecture in Southeast Asia. This period saw many classical buildings constructed in the neoclassical and French Colonial style of architecture.",
  "culturalContext": "",
  "colors": [
    {
      "hex": "#cdc9c4",
      "name": "silver"
    },
    {
      "hex": "#6b6e63",
      "name": "umber"
    },
    {
      "hex": "#0e110d",
      "name": "black"
    }
  ],
  "paletteSource": "derived",
  "visualDNA": {},
  "typography": {},
  "typePairing": {},
  "materials": [],
  "textures": [],
  "lighting": {},
  "photography": {},
  "architecture": {},
  "fashion": {},
  "objects": [],
  "environment": {},
  "graphicDesign": {},
  "uiTranslation": {},
  "recipe": {},
  "emotionProfile": {},
  "dnaAxes": {},
  "keyExamples": [],
  "sounds": [],
  "tags": [
    "architecture of geographic location"
  ],
  "images": [
    {
      "url": "https://thumb.wikimedia.org/wikipedia/commons/thumb/c/c7/European_colonisation_of_Southeast_Asia.png/1280px-European_colonisation_of_Southeast_Asia.png",
      "thumb": "https://thumb.wikimedia.org/wikipedia/commons/thumb/c/c7/European_colonisation_of_Southeast_Asia.png/500px-European_colonisation_of_Southeast_Asia.png",
      "full": "https://upload.wikimedia.org/wikipedia/commons/c/c7/European_colonisation_of_Southeast_Asia.png",
      "pageUrl": "https://commons.wikimedia.org/wiki/File:European_colonisation_of_Southeast_Asia.png",
      "caption": "European colonisation of Southeast Asia. Legend: France ( French Indochina ) Netherlands ( Dutch East Indies ) Portugal ( Portuguese Timor ) Spain ( Spanish East Indies ) United Kingdom ( British Burma , Malaya and Borneo )",
      "source": "Wikimedia Commons",
      "artist": "Rumilo Santiago",
      "date": "2016-11-03",
      "license": "CC BY-SA 4.0",
      "licenseUrl": "https://creativecommons.org/licenses/by-sa/4.0",
      "width": "1280",
      "height": "1047",
      "check": {
        "ok": true,
        "status": 200,
        "checkedAt": "2026-09-19T12:55:09.876Z"
      }
    },
    {
      "url": "https://thumb.wikimedia.org/wikipedia/commons/thumb/c/cc/Hano%C3%AF_-_Pont_sur_le_Fleuve_Rouge.jpg/1280px-Hano%C3%AF_-_Pont_sur_le_Fleuve_Rouge.jpg",
      "thumb": "https://thumb.wikimedia.org/wikipedia/commons/thumb/c/cc/Hano%C3%AF_-_Pont_sur_le_Fleuve_Rouge.jpg/500px-Hano%C3%AF_-_Pont_sur_le_Fleuve_Rouge.jpg",
      "full": "https://upload.wikimedia.org/wikipedia/commons/c/cc/Hano%C3%AF_-_Pont_sur_le_Fleuve_Rouge.jpg",
      "pageUrl": "https://commons.wikimedia.org/wiki/File:Hano%C3%AF_-_Pont_sur_le_Fleuve_Rouge.jpg",
      "caption": "Cầu Long Biên thời thuộc Pháp với tên gọi pont Paul Doumer .",
      "source": "Wikimedia Commons",
      "artist": "Unknown author Unknown author",
      "license": "Public domain",
      "width": "1280",
      "height": "820",
      "check": {
        "ok": true,
        "status": 200,
        "checkedAt": "2026-09-19T12:55:09.876Z"
      }
    },
    {
      "url": "https://thumb.wikimedia.org/wikipedia/commons/thumb/b/ba/Sofitel_Metropole%2C_Ng%C3%B4_Quy%E1%BB%81n_-_2022-09-02_02.jpg/1280px-Sofitel_Metropole%2C_Ng%C3%B4_Quy%E1%BB%81n_-_2022-09-02_02.jpg",
      "thumb": "https://thumb.wikimedia.org/wikipedia/commons/thumb/b/ba/Sofitel_Metropole%2C_Ng%C3%B4_Quy%E1%BB%81n_-_2022-09-02_02.jpg/500px-Sofitel_Metropole%2C_Ng%C3%B4_Quy%E1%BB%81n_-_2022-09-02_02.jpg",
      "full": "https://upload.wikimedia.org/wikipedia/commons/b/ba/Sofitel_Metropole%2C_Ng%C3%B4_Quy%E1%BB%81n_-_2022-09-02_02.jpg",
      "pageUrl": "https://commons.wikimedia.org/wiki/File:Sofitel_Metropole,_Ng%C3%B4_Quy%E1%BB%81n_-_2022-09-02_02.jpg",
      "caption": "Hotel Metropole Hanoi, Hanoi, Vietnam.",
      "source": "Wikimedia Commons",
      "artist": "The Hanoian",
      "date": "2022-09-02 12:24:07",
      "license": "CC BY-SA 4.0",
      "licenseUrl": "https://creativecommons.org/licenses/by-sa/4.0",
      "width": "1280",
      "height": "853",
      "check": {
        "ok": true,
        "status": 200,
        "checkedAt": "2026-09-19T12:55:09.876Z"
      }
    },
    {
      "url": "https://thumb.wikimedia.org/wikipedia/commons/thumb/b/bd/Asian_Civilisations_Museum%2C_Dec_05.JPG/1280px-Asian_Civilisations_Museum%2C_Dec_05.JPG",
      "thumb": "https://thumb.wikimedia.org/wikipedia/commons/thumb/b/bd/Asian_Civilisations_Museum%2C_Dec_05.JPG/500px-Asian_Civilisations_Museum%2C_Dec_05.JPG",
      "full": "https://upload.wikimedia.org/wikipedia/commons/b/bd/Asian_Civilisations_Museum%2C_Dec_05.JPG",
      "pageUrl": "https://commons.wikimedia.org/wiki/File:Asian_Civilisations_Museum,_Dec_05.JPG",
      "caption": "Asian Civilisations Museum, Dec 05",
      "source": "Wikimedia Commons",
      "license": "Copyrighted free use",
      "width": "1280",
      "height": "960",
      "check": {
        "ok": true,
        "status": 200,
        "checkedAt": "2026-09-19T12:55:09.876Z"
      }
    },
    {
      "url": "https://thumb.wikimedia.org/wikipedia/commons/thumb/d/dd/Shophouses_along_South_Bridge_Road%2C_Singapore_-_20121013.jpg/1280px-Shophouses_along_South_Bridge_Road%2C_Singapore_-_20121013.jpg",
      "thumb": "https://thumb.wikimedia.org/wikipedia/commons/thumb/d/dd/Shophouses_along_South_Bridge_Road%2C_Singapore_-_20121013.jpg/500px-Shophouses_along_South_Bridge_Road%2C_Singapore_-_20121013.jpg",
      "full": "https://upload.wikimedia.org/wikipedia/commons/d/dd/Shophouses_along_South_Bridge_Road%2C_Singapore_-_20121013.jpg",
      "pageUrl": "https://commons.wikimedia.org/wiki/File:Shophouses_along_South_Bridge_Road,_Singapore_-_20121013.jpg",
      "caption": "Shophouses along South Bridge Road , Singapore.",
      "source": "Wikimedia Commons",
      "artist": "Nicolas Lannuzel .",
      "date": "13 October 2012, 11:20:33 (according to Exif data).",
      "license": "CC BY-SA 2.0",
      "licenseUrl": "https://creativecommons.org/licenses/by-sa/2.0",
      "width": "1280",
      "height": "854",
      "check": {
        "ok": true,
        "status": 200,
        "checkedAt": "2026-09-19T12:55:09.876Z"
      }
    },
    {
      "url": "https://thumb.wikimedia.org/wikipedia/commons/thumb/a/ae/Ministers_building%2C_Yangon%2C_Myanmar.jpg/1280px-Ministers_building%2C_Yangon%2C_Myanmar.jpg",
      "thumb": "https://thumb.wikimedia.org/wikipedia/commons/thumb/a/ae/Ministers_building%2C_Yangon%2C_Myanmar.jpg/500px-Ministers_building%2C_Yangon%2C_Myanmar.jpg",
      "full": "https://upload.wikimedia.org/wikipedia/commons/a/ae/Ministers_building%2C_Yangon%2C_Myanmar.jpg",
      "pageUrl": "https://commons.wikimedia.org/wiki/File:Ministers_building,_Yangon,_Myanmar.jpg",
      "caption": "Foto de la entrada oeste (desde la calle) de este edificio, la mayoria del complejo esta cubierto de andamios, por lo que es posible que se esten realizando algun tipo de restauracion, a parte de este hecho actualmente aparenta totalmente abandonado.",
      "source": "Wikimedia Commons",
      "artist": "Mejillon095",
      "date": "24 October 2016 (according to Exif data)",
      "license": "CC BY-SA 3.0",
      "licenseUrl": "https://creativecommons.org/licenses/by-sa/3.0",
      "width": "1280",
      "height": "720",
      "check": {
        "ok": true,
        "status": 200,
        "checkedAt": "2026-09-19T12:55:09.876Z"
      }
    }
  ],
  "sources": [
    {
      "name": "Wikipedia — Colonial architecture of Southeast Asia",
      "url": "https://en.wikipedia.org/wiki/Colonial_architecture_of_Southeast_Asia",
      "tier": "B",
      "check": {
        "ok": true,
        "status": 200,
        "checkedAt": "2026-09-19T12:55:09.876Z"
      }
    },
    {
      "name": "Wikidata — Q67473409",
      "url": "https://www.wikidata.org/wiki/Q67473409",
      "tier": "B",
      "check": {
        "ok": true,
        "status": 200,
        "checkedAt": "2026-09-19T12:55:09.876Z"
      }
    }
  ],
  "references": [
    {
      "type": "archive",
      "title": "Wikidata — Q67473409",
      "url": "https://www.wikidata.org/wiki/Q67473409",
      "note": "Structured data: dates, places, people, identifiers",
      "check": {
        "ok": true,
        "status": 200,
        "checkedAt": "2026-09-19T12:55:09.876Z"
      }
    },
    {
      "type": "article",
      "title": "Wikipedia — Colonial architecture of Southeast Asia",
      "url": "https://en.wikipedia.org/wiki/Colonial_architecture_of_Southeast_Asia",
      "note": "Encyclopedia article",
      "check": {
        "ok": true,
        "status": 200,
        "checkedAt": "2026-09-19T12:55:09.876Z"
      }
    }
  ],
  "wikidata": "Q67473409",
  "wikipedia": "Colonial architecture of Southeast Asia",
  "popularity": 35,
  "isNiche": false,
  "dataQuality": "moderately_documented",
  "verifiedAt": null,
  "createdAt": "2026-09-18T15:08:19.201Z",
  "updatedAt": "2026-10-02T06:41:24.429Z"
}
