{
  "slug": "palaung-traditional-costume",
  "name": "Palaung traditional costume",
  "aliases": [],
  "category": "Fashion & Dress",
  "subcategory": "Traditional Clothing in Myanmar",
  "establishment": "regional_tradition",
  "status": "draft",
  "confidence": 60,
  "origin": "",
  "geography": "",
  "periodStart": "",
  "periodEnd": "",
  "startYear": null,
  "endYear": null,
  "era": "",
  "summary": "The Palaung traditional costume refers to the traditional clothing worn by the Palaung people (also known as the Ta'ang), an ethnic group primarily residing in Myanmar with smaller communities in northern Thailand and southern China.",
  "description": "The Palaung traditional costume refers to the traditional clothing worn by the Palaung people (also known as the Ta'ang), an ethnic group primarily residing in Myanmar with smaller communities in northern Thailand and southern China. The Palaung traditional attire features vibrant colors, intricate embroidery, and silver ornaments reflecting the cultural identity and heritage of the Palaung people.\n\nA traditional Palaung woman's outfit consists of a long-sleeved blouse and a wrap-around skirt known as a longyi, worn with a distinctive belt adorned with silver discs. In contrast, men's clothing is simpler, typically consisting of plain shirts and trousers. The patterns, colors, and accessories often indicate marital status, social standing, or regional identity. Traditional attire is primarily worn during religious ceremonies, festivals and other significant cultural events.",
  "culturalContext": "",
  "colors": [
    {
      "hex": "#867066",
      "name": "bronze"
    },
    {
      "hex": "#6d4d4c",
      "name": "umber"
    },
    {
      "hex": "#aa9d90",
      "name": "warm grey"
    },
    {
      "hex": "#af3546",
      "name": "brick"
    },
    {
      "hex": "#45282e",
      "name": "aubergine"
    },
    {
      "hex": "#931f32",
      "name": "crimson"
    }
  ],
  "paletteSource": "derived",
  "visualDNA": {},
  "typography": {},
  "typePairing": {},
  "materials": [],
  "textures": [],
  "lighting": {},
  "photography": {},
  "architecture": {},
  "fashion": {},
  "objects": [],
  "environment": {},
  "graphicDesign": {},
  "uiTranslation": {},
  "recipe": {},
  "emotionProfile": {},
  "dnaAxes": {},
  "keyExamples": [],
  "sounds": [],
  "tags": [
    "traditional costume"
  ],
  "images": [
    {
      "url": "https://upload.wikimedia.org/wikipedia/commons/9/98/Palong_women_Chiang_Dao_district.jpg",
      "thumb": "https://upload.wikimedia.org/wikipedia/commons/9/98/Palong_women_Chiang_Dao_district.jpg",
      "full": "https://upload.wikimedia.org/wikipedia/commons/9/98/Palong_women_Chiang_Dao_district.jpg",
      "pageUrl": "https://commons.wikimedia.org/wiki/File:Palong_women_Chiang_Dao_district.jpg",
      "caption": "palaung womwen dressed in traditional attire",
      "source": "Wikimedia Commons",
      "artist": "Frans Betgem",
      "date": "2015-09-09",
      "license": "CC BY-SA 2.5",
      "licenseUrl": "https://creativecommons.org/licenses/by-sa/2.5",
      "width": "1000",
      "height": "750"
    },
    {
      "url": "https://upload.wikimedia.org/wikipedia/commons/c/cf/Palong_girl_Chiang_Dao_district.jpg",
      "thumb": "https://upload.wikimedia.org/wikipedia/commons/c/cf/Palong_girl_Chiang_Dao_district.jpg",
      "full": "https://upload.wikimedia.org/wikipedia/commons/c/cf/Palong_girl_Chiang_Dao_district.jpg",
      "pageUrl": "https://commons.wikimedia.org/wiki/File:Palong_girl_Chiang_Dao_district.jpg",
      "caption": "A Palaung girl dreesed in Palong traditional attire",
      "source": "Wikimedia Commons",
      "artist": "Frans Betgem",
      "date": "2015-09-09",
      "license": "CC BY-SA 2.5",
      "licenseUrl": "https://creativecommons.org/licenses/by-sa/2.5",
      "width": "1000",
      "height": "750"
    },
    {
      "url": "https://upload.wikimedia.org/wikipedia/commons/3/34/Palaung_Woman_Kalaw_Shan_Myanmar.jpg",
      "thumb": "https://upload.wikimedia.org/wikipedia/commons/3/34/Palaung_Woman_Kalaw_Shan_Myanmar.jpg",
      "full": "https://upload.wikimedia.org/wikipedia/commons/3/34/Palaung_Woman_Kalaw_Shan_Myanmar.jpg",
      "pageUrl": "https://commons.wikimedia.org/wiki/File:Palaung_Woman_Kalaw_Shan_Myanmar.jpg",
      "caption": "A Palaung tribal woman near Kalaw, Shan State, Myanmar.",
      "source": "Wikimedia Commons",
      "artist": "Jialiang Gao www.peace-on-earth.org",
      "date": "2004-01",
      "license": "CC BY-SA 2.5",
      "licenseUrl": "https://creativecommons.org/licenses/by-sa/2.5",
      "width": "900",
      "height": "704"
    },
    {
      "url": "https://upload.wikimedia.org/wikipedia/commons/5/50/Palong_woman_Chiang_Dao_district.jpg",
      "thumb": "https://upload.wikimedia.org/wikipedia/commons/5/50/Palong_woman_Chiang_Dao_district.jpg",
      "full": "https://upload.wikimedia.org/wikipedia/commons/5/50/Palong_woman_Chiang_Dao_district.jpg",
      "pageUrl": "https://commons.wikimedia.org/wiki/File:Palong_woman_Chiang_Dao_district.jpg",
      "caption": "A palaung women dressed in tarditional attire",
      "source": "Wikimedia Commons",
      "artist": "Frans Betgem",
      "date": "2015-09-09",
      "license": "CC BY-SA 2.5",
      "licenseUrl": "https://creativecommons.org/licenses/by-sa/2.5",
      "width": "1000",
      "height": "563"
    },
    {
      "url": "https://www.artic.edu/iiif/2/13ec274d-ce05-b55d-88ee-c716b6b6a5c8/full/843,/0/default.jpg",
      "thumb": "https://www.artic.edu/iiif/2/13ec274d-ce05-b55d-88ee-c716b6b6a5c8/full/400,/0/default.jpg",
      "full": "https://www.artic.edu/iiif/2/13ec274d-ce05-b55d-88ee-c716b6b6a5c8/full/1686,/0/default.jpg",
      "pageUrl": "https://www.artic.edu/artworks/576",
      "caption": "Fan, 18th century",
      "source": "Art Institute of Chicago",
      "artist": "France",
      "date": "18th century",
      "license": "Public domain (CC0)",
      "licenseUrl": "https://creativecommons.org/publicdomain/zero/1.0/",
      "width": "843",
      "height": "700"
    },
    {
      "url": "https://www.artic.edu/iiif/2/2c7b5171-f708-0832-bb41-03f4c8f06b3d/full/843,/0/default.jpg",
      "thumb": "https://www.artic.edu/iiif/2/2c7b5171-f708-0832-bb41-03f4c8f06b3d/full/400,/0/default.jpg",
      "full": "https://www.artic.edu/iiif/2/2c7b5171-f708-0832-bb41-03f4c8f06b3d/full/1686,/0/default.jpg",
      "pageUrl": "https://www.artic.edu/artworks/796",
      "caption": "Atsuita karaori (Noh Costume), late Edo period (1789–1868), 1801/25",
      "source": "Art Institute of Chicago",
      "artist": "Japan",
      "date": "late Edo period (1789–1868), 1801/25",
      "license": "Public domain (CC0)",
      "licenseUrl": "https://creativecommons.org/publicdomain/zero/1.0/",
      "width": "843",
      "height": "926"
    },
    {
      "url": "https://www.artic.edu/iiif/2/2a3ef0b3-3e4a-a5f9-d581-372ac850b99a/full/843,/0/default.jpg",
      "thumb": "https://www.artic.edu/iiif/2/2a3ef0b3-3e4a-a5f9-d581-372ac850b99a/full/400,/0/default.jpg",
      "full": "https://www.artic.edu/iiif/2/2a3ef0b3-3e4a-a5f9-d581-372ac850b99a/full/1686,/0/default.jpg",
      "pageUrl": "https://www.artic.edu/artworks/516",
      "caption": "Dress for Christ Child, 18th century",
      "source": "Art Institute of Chicago",
      "artist": "Spain",
      "date": "18th century",
      "license": "Public domain (CC0)",
      "licenseUrl": "https://creativecommons.org/publicdomain/zero/1.0/",
      "width": "843",
      "height": "516"
    },
    {
      "url": "https://www.artic.edu/iiif/2/c3e58139-f4d2-78e7-73ad-0c9d558d277e/full/843,/0/default.jpg",
      "thumb": "https://www.artic.edu/iiif/2/c3e58139-f4d2-78e7-73ad-0c9d558d277e/full/400,/0/default.jpg",
      "full": "https://www.artic.edu/iiif/2/c3e58139-f4d2-78e7-73ad-0c9d558d277e/full/1686,/0/default.jpg",
      "pageUrl": "https://www.artic.edu/artworks/916",
      "caption": "Shawl Border Fragment, 1815/20",
      "source": "Art Institute of Chicago",
      "artist": "India",
      "date": "1815/20",
      "license": "Public domain (CC0)",
      "licenseUrl": "https://creativecommons.org/publicdomain/zero/1.0/",
      "width": "843",
      "height": "344"
    }
  ],
  "sources": [
    {
      "name": "Wikipedia — Palaung traditional costume",
      "url": "https://en.wikipedia.org/wiki/Palaung_traditional_costume",
      "tier": "B",
      "check": {
        "ok": true,
        "status": 200,
        "checkedAt": "2026-09-18T10:32:48.407Z"
      }
    },
    {
      "name": "Wikidata — Q134503285",
      "url": "https://www.wikidata.org/wiki/Q134503285",
      "tier": "B",
      "check": {
        "ok": true,
        "status": 200,
        "checkedAt": "2026-09-18T10:32:48.407Z"
      }
    }
  ],
  "references": [
    {
      "type": "archive",
      "title": "Wikidata — Q134503285",
      "url": "https://www.wikidata.org/wiki/Q134503285",
      "note": "Structured data: dates, places, people, identifiers",
      "check": {
        "ok": true,
        "status": 200,
        "checkedAt": "2026-09-18T10:59:14.835Z"
      }
    },
    {
      "type": "article",
      "title": "Wikipedia — Palaung traditional costume",
      "url": "https://en.wikipedia.org/wiki/Palaung_traditional_costume",
      "note": "Encyclopedia article",
      "check": {
        "ok": true,
        "status": 200,
        "checkedAt": "2026-09-18T10:59:14.835Z"
      }
    }
  ],
  "wikidata": "Q134503285",
  "wikipedia": "Palaung traditional costume",
  "popularity": 35,
  "isNiche": false,
  "dataQuality": "moderately_documented",
  "verifiedAt": null,
  "createdAt": "2026-09-18T10:32:48.407Z",
  "updatedAt": "2026-09-18T10:59:14.835Z"
}
